timestamp,user_page,search_query,intent,result1,result1_answer,result1_explanation,result2,result2_answer,result2_explanation,result3,result3_answer,result3_explanation,result4,result4_answer,result4_explanation,result5,result5_answer,result5_explanation,comments,worker_id
10/26/2014 10:38:52,http://www.pinterest.com/sarabolton3/,veil,"I enjoy looking at different types of wedding veils to add to my wedding board. I'm not engaged, but I like to plan little wedding things since my SO and I plan on getting married soon. ",http://www.pinterest.com/pin/402368547932094230/,Definitely not,"It's not actually a veil post, it's a tabloid that's talking about some celebrity wedding and the veil is just a tag word. I am not interested in celebrities. ",http://www.pinterest.com/pin/505458758151983883/,Definitely not,"I'm not a fan of the type of veil on this pin. It's really long, and I only like shorter veils. ",http://www.pinterest.com/pin/516647388475244309/,Probably not,"I think that the lace bordering on this veil is way to much. There's too much thick white detail, and I prefer mine to be mostly sheer and light. ",http://www.pinterest.com/pin/383580093236491281/,Definitely not,I am not really needing a chart just to tell me the different types of veils. I already know what length's I like. ,http://www.pinterest.com/pin/147352219032596298/,Definitely not,"It might be a useful utility, but I am just looking for pins to get a feel for my wedding tastes on my board. That's not even something I'm sure I'll need. ",,A31A4YKVSOYRVS
10/26/2014 10:49:53,http://www.pinterest.com/barbjkelly/,Thanksgiving Menu Ideas,I am hosting Thanksgiving this year so I was looking for some new ideas. I am looking for some new side dishes and was interested to see what other people's menus looked like.,http://www.pinterest.com/pin/43487952625598369/,Maybe,I will need to explore this Pin to see what he/she has on the menu.  At first glance it looks like it has possibilities.,http://www.pinterest.com/pin/573364596283651354/,Definitely not,This Pin is about hosting your first Thanksgiving.  I have hosted about 40 years of Thanksgiving's so I am not interested in exploring this Pin.,http://www.pinterest.com/pin/AXcExZZTgnheBhX1LqTf45uEHh8f7Yb-NJT5-AD9OwkwZtICSDq4E-gI9b5KiS6wEQ/,Definitely not,At first glance this Pin looks like it is an advertisement for all white dinnerware.  There is a stack of plates and a white ceramic pumpkin on the cover.  I'm not interested in new dishes so I wouldn't even click on this Pin.,http://www.pinterest.com/pin/272960427389274057/,Maybe,"This Pin looks like it might have only the more traditional Thanksgiving menu ideas.  I might check it out if I have time to explore but at first glance, I am thinking that I wouldn't find what I'm looking for here, even though I don't really know what exactly I am looking for.",http://www.pinterest.com/pin/348958671101506399/,Definitely not,"I wouldn't even look at this Pin because the title of the Pin is ""Healthy Thanksgiving Menu"". This is the one holiday that I don't even want to think about ""healthy"".  I make sure to have some simple, healthier options but I'm not going to cut back on the food that my family loves and expects to have on the table on Thanksgiving Day.",,AC5LU9TF9CTK9
10/26/2014 16:18:13,http://www.pinterest.com/laneuffer,Watch,I was looking to find a new watch that I could either buy or buy similar. I have not gotten a new watch in awhile and wanted to see what was in style.,http://www.pinterest.com/pin/516928863453746996/,Definitely,This is a watch that I find to be stylish. This is a watch that I think is in style and that I would wear. ,http://www.pinterest.com/pin/516928863453747008/,Definitely,I also find this watch to be attractive. This is a watch that matches the watch I would like to wear.,http://www.pinterest.com/pin/516928863453747013/,Probably not,This is not really my style of watch. I do not enjoy wearing the wrap around ones. ,http://www.pinterest.com/pin/516928863453747017/,Definitely not,This pin does not have to do with watches. I am not sure why this pin is on the watch category. ,http://www.pinterest.com/pin/516928863453747018/,Definitely,This watch matches clothes that I have. This watch is one that goes very well with my style. ,,A2GXHECU31O81V
10/26/2014 17:28:34,http://www.pinterest.com/swoleh/,hamsters,I really love hamsters. So I wanted to find more people who are posting about hamsters and their habitats.,http://www.pinterest.com/pin/563864815815129655/,Definitely,Adorable front facial picture of a dwarf hamster.,http://www.pinterest.com/pin/489907265687536272/,Definitely,Full front facial of a dwarf hamster with a happy face.,http://www.pinterest.com/pin/477733472944645453/,Definitely,Funny gif of a hamster being surprised at being touched while eating.,http://www.pinterest.com/pin/534098837031572928/,Definitely,Cute hamster in a pocket of a robe.,http://www.pinterest.com/pin/172614598187868596/,Definitely,Lovely set picture of a hamster at a miniature table. Fits well with those who love hamsters like me.,,A1DCPMWRNPJSGX
10/26/2014 17:51:13,http://www.pinterest.com/search/pins/?q=Pinterest%20Eval&term_meta%5B%5D=Pinterest%7Ctyped&term_meta%5B%5D=Eval%7Ctyped,elf on the shelf,As Christmas comes closer I have been looking for Elf on a Shelf ideas for my children. I thought maybe I could find some great ideas out there for this. ,http://www.pinterest.com/pin/66991113181248490/,Definitely,Just what I am looking for. Great idea for Elf on the shelf to use at home. ,http://www.pinterest.com/pin/279012139388222329/,Definitely,Amazing ideas. Just what I would be looking for. I love seeing all the cute elf on the shelf ideas out there. ,http://www.pinterest.com/pin/200550989630359297/,Definitely,Very cute Elf on the Shelf idea. Exaclty what I am looking for. ,http://www.pinterest.com/pin/540009811542949280/,Definitely,Super Cute idea for Elf on the Shelf. I can easily use this for new ideas this year. ,http://www.pinterest.com/pin/518828819543588401/,Definitely,Great idea for elf on the shelf. Something I would use for sure. ,,A3BL2ZEODD79AZ
10/26/2014 17:52:00,http://www.pinterest.com/nanaki254/,anime,I was looking for ideas for the video game I am making. I was looking for different types of anime styles and character types.,http://www.pinterest.com/pin/537335799264345462/,Maybe,"The image is of one character. The design is something that would not match the characters of the game I am making. It is an interesting design, so I might pin it in the future, but right now it is just an okay result.",http://www.pinterest.com/pin/208924870184464371/,Probably not,"The art is amazing and well done for this pin. However, I would not repin this in the same mindset i had earlier since the art style is not what I am going for in my game. It is irrelevant to me because it looks like a painting, and it won't give me much ideas or inspiration.",http://www.pinterest.com/pin/34340015879310105/,Definitely not,"Similar to Pin 3, the art is amazing and well done for this pin. However, I would not repin this in the same mindset i had earlier since the art style is not what I am going for in my game. It is irrelevant to me because it looks like a painting, and it won't give me much ideas or inspiration.",http://www.pinterest.com/pin/403635185327694986/,There's a good chance,I like this pin because it shows just a character design. It can give me inspiration that I can tell my artist what I want my characters to look like. There is nothing distracting me from the look of the character so I think this is a good result.,http://www.pinterest.com/pin/555209460286556394/,Maybe,This was an okay result to me because it seems like a portrait picture and it doesn't really help me as much as other pins. I can see detail which might help me in full art. However it is not as good as other pins because it doesn't show the character entirely so I can't really get inspiration from it.,,A38VOZIC9QGEGU
10/26/2014 17:53:48,http://www.pinterest.com/jessicakain/,rococo bedroom,"I have a comforter that is kind of ugly but I don't want to buy a new one. It reminds me of Modern Rococo, so I looked up rococo bedroom to find ideas of how I can decorate around this comforter.",http://www.pinterest.com/pin/419890365231245563/,Definitely,This is a photo of a beautiful bed and it leads to a news article covering the entire estate where the bedroom exists. I looked through the entire set for ideas and was fascinated.,http://www.pinterest.com/pin/234116880601926399/,There's a good chance,This bed in this photo result is pretty ugly but it leads to a good article that gave me some nice ideas and inspiration. They are fancy and work for me but not quite rococo.,http://www.pinterest.com/pin/427279083369348454/,Definitely,A photo result of Marie Antoinette's bedroom gives me great inspiration and the pin links to a blog that covers her entire bed chamber. I loved this pin because it was from a blogger's tour of Versailles and it gave me a personal first hand look that I've never found anywhere else.,http://www.pinterest.com/pin/295619163013063647/,Definitely not,"This pin fits the style I'm looking for and leads to a website where I can purchase a chair. A $985 chair, which I would never buy. So this is not a good result for me. ",http://www.pinterest.com/pin/154459462194497913/,There's a good chance,This is a pin of a bedroom in the style I'm searching for. The pin leads to a website to purchase the bed and the display photos are showing the bed in different decorated bedrooms. This pin was great for inspiring me.,,A2Q009DS6B04P5
10/26/2014 18:01:17,http://www.pinterest.com/annieru27/,Disney World Autograph Ideas,We are going to Disney World and I wanted to have the kids get autographs on something other than an autograph book. I was looking for alternatives.,http://www.pinterest.com/pin/434456695277011447/,Probably not,It is definitely an idea for getting autographs at Disney World. But I'm looking for alternatives to an autograph book so this wouldn't fit for me.,http://www.pinterest.com/pin/248964685626127871/,Definitely,"This is exactly what I was looking for. This is an alternative to the regular, typical autograph book you usually see.",http://www.pinterest.com/pin/AWY11A8syP3Z7ghfcrgROupd0kv0hD2SoBPC_56o81h5LHioJ-yfLySnEcwFN3hcyQ/,Definitely not,It's a contest. It's about Disney World but it has nothing to do with autographs or anything.,http://www.pinterest.com/pin/501869952199381628/,Maybe,These are printable autograph cards. They're a cool idea but not really what I was looking for. I wanted something more outside of the box.,http://www.pinterest.com/pin/42784265185790802/,Definitely,"This is a list of ideas. I LOVE this, I love pins where it's a compilation of ideas versus just one idea. This is definitely something I would click on.",,ARJCTIBIT3OJ8
10/26/2014 18:17:26,http://www.pinterest.com/chelios7/,healthy,Looking for healthy meals that are new to me. I've been looking to cut back on sugars and carbs and wanted some fresh ideas.,http://www.pinterest.com/pin/129126714291473428/,Maybe,"It is not what I intended to find but after looking at it, it does provide a good way to liven up water in a healthy manner. I was looking more for recipes than this, so I'm not sure it is something I would pin or not.",http://www.pinterest.com/pin/56787645277313977/,Definitely not,It is not something that looks good to me. I'm not a big peanut butter fan and I don't eat a lot of desserts anyways. ,http://www.pinterest.com/pin/485825878527611510/,There's a good chance,"I like how simple they are to make. I also like avocado and chicken salad, so this is a good one and it's on the healthy side for sure.",http://www.pinterest.com/pin/48343395975660881/,Definitely,I am a big fan of chicken recipes and I love garlic. The picture looked very good. I did pin this to try later. ,http://www.pinterest.com/pin/289497082271163382/,Probably not,"Although it looks pretty good, I am trying to cut carbs and this looks loaded with them. I'm also not a big fan of pastas, so it didn't interest me much anyways for that reason.",,A13XNKKN2LI6DF